{
  "format": "hitomon-study-plan",
  "version": 2,
  "qualificationId": "ap",
  "timeZone": "Asia/Tokyo",
  "examDates": [
    {
      "examPartId": "objective",
      "date": "2026-11-04"
    }
  ],
  "phases": [
    {
      "id": "foundation",
      "name": "基礎確認",
      "start": "2026-10-07",
      "end": "2026-10-18",
      "examPartIds": [
        "objective",
        "written"
      ],
      "focusTopicIds": [
        "database",
        "network",
        "security"
      ],
      "weeklyTargets": [
        {
          "id": "week-1",
          "start": "2026-10-07",
          "end": "2026-10-13",
          "goals": [
            {
              "examPartId": "objective",
              "unit": "questionAttempts",
              "target": 70
            },
            {
              "examPartId": "written",
              "unit": "cases",
              "target": 1
            }
          ]
        },
        {
          "id": "week-2",
          "start": "2026-10-14",
          "end": "2026-10-18",
          "goals": [
            {
              "examPartId": "objective",
              "unit": "questionAttempts",
              "target": 50
            },
            {
              "examPartId": "written",
              "unit": "cases",
              "target": 2
            }
          ]
        }
      ],
      "milestones": [
        {
          "id": "mock-check",
          "name": "手元の教材で模試を解く",
          "date": "2026-10-18",
          "examPartId": "objective",
          "completed": false
        }
      ],
      "goals": [
        {
          "examPartId": "objective",
          "unit": "questionAttempts",
          "target": 120
        },
        {
          "examPartId": "written",
          "unit": "cases",
          "target": 3
        }
      ]
    }
  ],
  "context": {
    "studiedScope": "基礎の教科書を一周。計算とDBは追加で確認したい。",
    "materials": "手元の教科書と、ひと問の過去問",
    "weeklyMinutes": 180,
    "constraints": "休日を中心に。平日は短い時間で1問から。",
    "rationale": "まず分野を広く確認し、その結果を見て次の期間を相談する。",
    "updatedOn": "2026-10-07"
  }
}
